{
  "eventId": "018f47a5-8b77-7c5a-9c56-38db8aa4b180",
  "kind": "event",
  "eventType": "approver.application.summary-changed",
  "schemaVersion": 1,
  "sourceSystem": "approver",
  "tenantId": "tenant-local",
  "aggregateType": "Application",
  "aggregateId": "app-123",
  "aggregateVersion": 7,
  "correlationId": "workflow-456",
  "occurredAt": "2026-09-15T15:30:00Z",
  "payload": {
    "applicationId": "app-123",
    "status": "IN_REVIEW"
  },
  "metadata": {
    "traceId": "trace-789"
  }
}
